<?xml version="1.0"?>
<!DOCTYPE scenario SYSTEM "./dtd/PipeOrganScenario.dtd">

<!-- Normal Scenarios for different kinds of Problems AT handles -->

<scenario>

	<databaseConnection name="h2Connection" user=""
		password="" driver="org.h2.Driver" dsn="jdbc:h2:tcp://localhost/~/test" />

	<iterateEvent count="1500000" interval="1000">
		<!-- Normal Scenario for heap resource. -->
      	<servlet milestones="no" uri="ExecutorServlet_4" 
      		port="8080" host="localhost" 
      		x-apm-bt="t=4F2504E0-4F89-9B0C-0305E82C2301;d=2b6f0cc904d137be2e1730235f5664094b831186;v=1.0;n=TMobile;l=3g;g=94015-1523;a=Tomcat Example$bs=PipeOrganApp;bt=User_Stall;p=iOS;pv=8.1"  
      		contextroot="/pipeorgan">
			<webService uri="http://localhost:8080/pipeorgan/services/PipeOrganWebService_4" requestsize="10">
				<message>Entered Web Service, Stalling... </message>
          		<wait duration="400"/>
				<message>Exiting Web Service</message>
			</webService>
		</servlet>

		<!-- Normal Scenario for deployment based merging. -->
		<servlet milestones="no" uri="ExecutorServlet_11" port="8080"
			host="localhost" receiveError="yes"
			x-apm-bt="t=4F2504E0-4F89-9B0C-0305E82C2301;d=2b6f0cc904d137be2e1730235f5664094b831186;v=1.0;n=VERIZON;l=3g;g=94015-1523;a=Tomcat Example$bs=PipeOrganApp;bt=Multiple_Users;p=iOS;pv=9.3">
			<servlet milestones="no" uri="ExecutorServlet_12" port="8080"
				host="localhost" receiveError="yes">
				<custom class="com.wily.tools.pipeorgan.extensions.VariableWait"
					args="minduration=60,maxduration=100,outlierduration=100" />
			</servlet>
		</servlet>
		
		
		<!-- Normal Scenario for deployment based merging for webservice. -->
		<servlet milestones="no" uri="ExecutorServlet_16" port="8080"
			host="localhost" receiveError="yes"
			x-apm-bt="t=4F2504E0-4F89-9B0C-0305E82C2301;d=2b6f0cc904d137be2e1730235f5664094b831186;v=1.0;n=VERIZON;l=3g;g=94015-1523;a=Tomcat Example$bs=PipeOrganApp;bt=Multiple_Users_WS;p=iOS;pv=9.3">
			<webService
				uri="http://crossMachine:8080/pipeorgan/services/PipeOrganWebService_16"
				requestsize="10">
				<message>Entered Web Service </message>
				<custom class="com.wily.tools.pipeorgan.extensions.VariableWait"
					args="minduration=40,maxduration=100,outlierduration=100" />
				<message>Exiting Web Service</message>
			</webService>
		</servlet>
	</iterateEvent>
</scenario>
