<?xml version="1.0"?>
<!DOCTYPE scenario SYSTEM "./dtd/PipeOrganScenario.dtd">

<!-- Problem Scenario for default Analyst in a BT. Servlet calls webservice 
	with slight delay in webservice reply. -->

<scenario>
	<iterateEvent count="200" interval="100">
		<servlet milestones="no" uri="ExecutorServlet_5" port="8080"
			host="localhost"
			x-apm-bt="t=4F2504E0-4F89-9B0C-0305E82C2301;d=2b6f0cc904d137be2e1730235f5664094b831186;v=1.0;n=TMobile;l=3g;g=94015-1523;a=Tomcat Example$bs=PipeOrganApp;bt=Cart_Checkout;p=iOS;pv=8.1"
			contextroot="/pipeorgan">
			<message>Start Normal scenario on WebService from BT for Default
				Analysts</message>
			<webService 
				uri="http://localhost:8080/pipeorgan/services/PipeOrganWebService_2" 
				requestsize="10">
				<message>Entered Web Service</message>
				<custom class="com.wily.tools.pipeorgan.extensions.VariableWait"
					args="minduration=400,maxduration=800,outlierduration=800" />
			</webService>
			<message>Normal Scenario Started</message>
		</servlet>
	</iterateEvent>
</scenario>
