<?xml version="1.0"?>
<!DOCTYPE scenario SYSTEM "./dtd/PipeOrganScenario.dtd">

<!-- Problem Scenario for alerts events. Generates 5 alerts on webservice_3. 
	ExecutorServlet_7 calls PipeOrganWebService_3 with 5 alerts in different 
	parts of trace. -->

<scenario>
	<iterateEvent count="4" interval="100">
      	<servlet milestones="no" uri="ExecutorServlet_7" port="8080" 
      		host="localhost" 
      		x-apm-bt="t=4F2504E0-4F89-9B0C-0305E82C2301;d=2b6f0cc904d137be2e1730235f5664094b831186;v=1.0;n=TMobile;l=3g;g=94015-1523;a=Tomcat Example$bs=PipeOrganApp;bt=User_Alert;p=iOS;pv=8.1"
      	  	contextroot="/pipeorgan">
			
			<servlet milestones="no" uri="ExecutorServlet_6" port="8080"
				host="localhost" contextroot="/pipeorgan">
				<message>Start stall scenario</message>
				<webService uri="http://localhost:8080/pipeorgan/services/PipeOrganWebService_3" requestsize="10">
					<message>Entered Web Service, Stalling... </message>
         			<wait duration="40000"/>
					<message>Exiting Web Service</message>
				</webService>
			</servlet>
		</servlet>
	</iterateEvent>
</scenario>